{
  "$schema": "http://json-schema.org/draft-07/schema#",
  "type": "object",
  "properties": {
    "Status": {
      "type": "string"
    },
    "StackId": {
      "type": "string"
    },
    "RequestId": {
      "type": "string"
    },
    "LogicalResourceId": {
      "type": "string"
    },
    "PhysicalResourceId": {
      "type": "string"
    }
  },
  "required": [
    "LogicalResourceId",
    "PhysicalResourceId",
    "RequestId",
    "StackId",
    "Status"
  ]
}